{
  "_meta": {
    "name": "Indonesian",
    "nativeName": "Bahasa Indonesia",
    "code": "id-ID"
  },
  "noActivity": "Tidak ada aktivitas dalam 24 jam terakhir.",
  "summaryFailed": "⚠️ Gagal membuat ringkasan.",
  "skillsFailed": "⚠️ Gagal membuat ringkasan keterampilan.",
  "trendingNoData": "⚠️ Data tren tidak tersedia, tidak dapat membuat laporan.",
  "trendingFailed": "⚠️ Gagal membuat laporan tren.",
  "webNoNewContent": "Tidak ada konten baru ditemukan.",
  "webFetchFailed": "⚠️ Gagal mengambil konten web.",
  "hnFetchFailed": "⚠️ Gagal mengambil data HN.",
  "cliTitle": "Digital Komunitas Alat CLI AI",
  "cliMeta": "> Dibuat: {utcStr} UTC | Alat yang dicakup: {count}",
  "cliSkillsHeading": "## Sorotan Keterampilan Claude Code",
  "cliSkillsSource": "> Sumber: [{repo}](https://github.com/{repo})",
  "cliComparison": "## Perbandingan Antar-Alat",
  "cliDetail": "## Laporan Per-Alat",
  "openclawTitle": "Digital Ekosistem OpenClaw",
  "openclawMeta": "> Isu: {issues} | PR: {prs} | Proyek yang dicakup: {projects} | Dibuat: {utcStr} UTC",
  "openclawDeepDive": "## Pendalaman OpenClaw",
  "openclawComparison": "## Perbandingan Antar-Ekosistem",
  "openclawPeers": "## Laporan Proyek Rekan",
  "webTitle": "Laporan Konten AI Resmi",
  "webMeta": "> {mode} | Konten baru: {count} artikel | Dibuat: {utcStr} UTC",
  "webFirstCrawl": "Perayapan lengkap pertama",
  "webTodayUpdate": "Pembaruan hari ini",
  "webNewContent": "Konten baru: {count} artikel",
  "webGenerated": "Dihasilkan: {utcStr} UTC",
  "webSourcesHeader": "Sumber:",
  "webFirstCrawlNote": "Ini adalah perayapan lengkap pertama. Harap fokus pada lanskap konten secara keseluruhan, konteks historis, dan tema inti setiap situs, bukan artikel individual.",
  "webIncrementalNote": "Ini adalah pembaruan bertahap. Harap fokus pada konten baru hari ini dan evaluasi signifikansi strategisnya dalam konteks.",
  "trendingTitle": "Tren Open Source AI",
  "trendingSources": "> Sumber: GitHub Trending + GitHub Search API | Dibuat: {utcStr} UTC",
  "hnTitle": "Digital Komunitas AI Hacker News",
  "phTitle": "Ringkasan Produk AI dari Product Hunt",
  "arxivTitle": "Ringkasan Riset AI dari ArXiv",
  "hfTitle": "Ringkasan Model Trending Hugging Face",
  "communityTitle": "Ringkasan AI Komunitas Teknologi",
  "weeklyTitle": "Laporan Mingguan Ekosistem Alat AI",
  "weeklyCoverage": "Periode liputan",
  "monthlyTitle": "Laporan Bulanan Ekosistem Alat AI",
  "issueLabelCli": "digest",
  "issueLabelOpenclaw": "openclaw",
  "issueLabelWeb": "web",
  "issueLabelTrending": "trending",
  "issueLabelHn": "hn",
  "issueLabelPh": "ph",
  "issueLabelArxiv": "arxiv",
  "issueLabelHf": "hf",
  "issueLabelCommunity": "community",
  "issueTitleCli": "📊 Digital Komunitas Alat CLI AI",
  "issueTitleOpenclaw": "🦞 Digital Ekosistem OpenClaw",
  "issueTitleWeb": "🌐 Laporan Konten AI Resmi",
  "issueTitleTrending": "📈 Tren Open Source AI",
  "issueTitleHn": "📰 Digital AI Hacker News",
  "issueTitlePh": "🚀 Ringkasan AI Product Hunt",
  "issueTitleArxiv": "📚 Ringkasan Riset AI dari ArXiv",
  "issueTitleHf": "🤗 Model Trending Hugging Face",
  "issueTitleCommunity": "💬 Ringkasan AI Komunitas Teknologi",
  "autoGen": "Ringkasan ini dibuat secara otomatis oleh",
  "reportLabelAiCli": "Ringkasan Alat CLI AI",
  "reportLabelAiAgents": "Ringkasan Ekosistem Agen AI",
  "reportLabelAiWeb": "Laporan Resmi Konten AI",
  "reportLabelAiTrending": "Tren AI Sumber Terbuka",
  "reportLabelAiHn": "Ringkasan Komunitas AI Hacker News",
  "reportLabelAiPh": "Ringkasan Produk AI dari Product Hunt",
  "reportLabelAiArxiv": "Ringkasan Riset AI dari ArXiv",
  "reportLabelAiHf": "Ringkasan Model Trending Hugging Face",
  "reportLabelAiCommunity": "Ringkasan AI Komunitas Teknologi",
  "reportLabelAiWeekly": "Ringkasan Mingguan Alat AI",
  "reportLabelAiMonthly": "Ringkasan Bulanan Alat AI",
  "notifyCli": "Alat CLI AI",
  "notifyAgents": "Ekosistem Agen AI",
  "notifyWeb": "Pembaruan Resmi",
  "notifyTrending": "Tren GitHub",
  "notifyHn": "Komunitas HN",
  "notifyPh": "Product Hunt",
  "notifyArxiv": "Riset ArXiv",
  "notifyHf": "Model HF",
  "notifyCommunity": "Komunitas Teknologi",
  "notifyWeekly": "Alat AI Mingguan",
  "notifyMonthly": "Alat AI Bulanan",
  "notifyFooter": "",
  "formatItemAuthor": "Penulis",
  "formatItemCreated": "Dibuat",
  "formatItemUpdated": "Diperbarui",
  "formatItemComments": "Komentar",
  "formatItemUrl": "URL",
  "formatItemSummary": "Ringkasan",
  "sampleNote": "(Total: {total} item; menampilkan {sampled} teratas berdasarkan jumlah komentar)",
  "sampleNoteAll": "(Total: {total} item)",
  "noneStr": "Tidak Ada",
  "unableToExtract": "(Tidak dapat mengekstrak konten teks)",
  "issueTruncation": "\n\n---\n> ⚠️ Konten melebihi batas GitHub Issue. Lihat file Markdown yang telah dikomit untuk laporan lengkap.",
  "digestTruncation": "...[dipotong]",
  "weeklyTruncation": "...[dipotong]",
  "weeklyMeta": "> Cakupan: {range} | Dibuat: {utcStr} UTC",
  "monthlyMeta": "> Sumber: {sources} | Dibuat: {utcStr} UTC",
  "sourceLabelWeekly": "{n} laporan mingguan",
  "sourceLabelDailySampled": "{n} laporan harian (contoh setiap 4 hari)",
  "manifestCli": "Digital Alat CLI AI",
  "manifestAgents": "Digital Ekosistem Agen AI",
  "manifestWeb": "Laporan Konten AI Resmi",
  "manifestTrending": "Tren Open Source AI",
  "manifestHn": "Digital Komunitas AI Hacker News",
  "manifestWeekly": "Digital Mingguan Alat AI",
  "manifestMonthly": "Digital Bulanan Alat AI",
  "autoGenFooter": ".",
  "hnMeta": "> Sumber: [Hacker News](https://news.ycombinator.com/) | {count} cerita | Dihasilkan: {utcStr} UTC\n\n---\n\n",
  "phMeta": "> Sumber: [Product Hunt](https://www.producthunt.com/) | {count} produk | Dihasilkan: {utcStr} UTC\n\n---\n\n",
  "arxivMeta": "> Sumber: [ArXiv](https://arxiv.org/) (cs.AI, cs.CL, cs.LG) | {count} paper | Dihasilkan: {utcStr} UTC\n\n---\n\n",
  "hfMeta": "> Sumber: [Hugging Face Hub](https://huggingface.co/) | {count} model | Dihasilkan: {utcStr} UTC\n\n---\n\n",
  "communityMeta": "> Sumber: [Dev.to](https://dev.to/) ({devto} artikel) + [Lobste.rs](https://lobste.rs/) ({lobsters} cerita) | Dihasilkan: {utcStr} UTC\n\n---\n\n",
  "trendingMeta": "> {sources} | Dihasilkan: {utcStr} UTC\n\n---\n\n",
  "webSourcesAnthropic": "- Anthropic: [anthropic.com](https://www.anthropic.com) — {new} artikel baru (total sitemap: {total})",
  "webSourcesOpenai": "- OpenAI: [openai.com](https://openai.com) — {new} artikel baru (total sitemap: {total})",
  "webIssueTitle": "🌐 Laporan Resmi Konten AI {dateStr}",
  "webIssueTitleFirstCrawl": "🌐 Laporan Resmi Konten AI {dateStr} (Perayapan Lengkap Pertama)",
  "notifySuffixMonthly": " Bulanan",
  "notifySuffixWeekly": " Mingguan",
  "notifyFooterLinks": "<a href=\"{pagesUrl}\">🌐 Web UI</a>  ·  <a href=\"{pagesUrl}/feed.xml\">⊕ RSS</a>",
  "feishuFooterLinks": "[🌐 Web UI]({pagesUrl})  ·  [⊕ RSS]({pagesUrl}/feed.xml)",
  "trendingFetchFailed": "(Tidak dapat mengambil daftar Tren GitHub hari ini)",
  "searchNoResults": "(Tidak ada hasil pencarian)",
  "$schema": "../locale-schema.json"
}
