{
  "_meta": {
    "name": "Vietnamese",
    "nativeName": "Tiếng Việt",
    "code": "vi-VN"
  },
  "noActivity": "Không có hoạt động nào trong 24 giờ qua.",
  "summaryFailed": "⚠️ Tạo bản tóm tắt thất bại.",
  "skillsFailed": "⚠️ Tạo bản tóm tắt kỹ năng thất bại.",
  "trendingNoData": "⚠️ Dữ liệu xu hướng không khả dụng, không thể tạo báo cáo.",
  "trendingFailed": "⚠️ Tạo báo cáo xu hướng thất bại.",
  "webNoNewContent": "Không tìm thấy nội dung mới.",
  "webFetchFailed": "⚠️ Lấy nội dung web thất bại.",
  "hnFetchFailed": "⚠️ Lấy dữ liệu HN thất bại.",
  "cliTitle": "Bản Tin Cộng Đồng Công Cụ CLI AI",
  "cliMeta": "> Được tạo: {utcStr} UTC | Công cụ được theo dõi: {count}",
  "cliSkillsHeading": "## Điểm Nổi Bật Kỹ Năng Claude Code",
  "cliSkillsSource": "> Nguồn: [{repo}](https://github.com/{repo})",
  "cliComparison": "## So Sánh Giữa Các Công Cụ",
  "cliDetail": "## Báo Cáo Theo Từng Công Cụ",
  "openclawTitle": "Bản Tin Hệ Sinh Thái OpenClaw",
  "openclawMeta": "> Issue: {issues} | PR: {prs} | Dự án được theo dõi: {projects} | Được tạo: {utcStr} UTC",
  "openclawDeepDive": "## Phân Tích Chuyên Sâu OpenClaw",
  "openclawComparison": "## So Sánh Giữa Các Hệ Sinh Thái",
  "openclawPeers": "## Báo Cáo Dự Án Đồng Cấp",
  "webTitle": "Báo Cáo Nội Dung AI Chính Thức",
  "webMeta": "> {mode} | Nội dung mới: {count} bài viết | Được tạo: {utcStr} UTC",
  "webFirstCrawl": "Lần thu thập đầy đủ đầu tiên",
  "webTodayUpdate": "Cập nhật hôm nay",
  "webNewContent": "Nội dung mới: {count} bài viết",
  "webGenerated": "Tạo lúc: {utcStr} UTC",
  "webSourcesHeader": "Nguồn:",
  "webFirstCrawlNote": "Đây là lần thu thập đầy đủ đầu tiên. Vui lòng tập trung vào toàn cảnh nội dung, bối cảnh lịch sử và các chủ đề cốt lõi của mỗi trang web, thay vì từng bài viết riêng lẻ.",
  "webIncrementalNote": "Đây là bản cập nhật tăng dần. Vui lòng tập trung vào nội dung mới hôm nay và đánh giá ý nghĩa chiến lược của nó trong bối cảnh.",
  "trendingTitle": "Xu Hướng Mã Nguồn Mở AI",
  "trendingSources": "> Nguồn: GitHub Trending + GitHub Search API | Được tạo: {utcStr} UTC",
  "hnTitle": "Bản Tin Cộng Đồng AI Trên Hacker News",
  "phTitle": "Tóm tắt Sản phẩm AI từ Product Hunt",
  "arxivTitle": "Tóm tắt Nghiên cứu AI từ ArXiv",
  "hfTitle": "Tóm tắt Mô hình Nổi bật trên Hugging Face",
  "communityTitle": "Tóm tắt AI từ Cộng đồng Công nghệ",
  "weeklyTitle": "Báo Cáo Hàng Tuần Về Hệ Sinh Thái Công Cụ AI",
  "weeklyCoverage": "Thời gian bao phủ",
  "monthlyTitle": "Báo Cáo Hàng Tháng Về Hệ Sinh Thái Công Cụ AI",
  "issueLabelCli": "digest",
  "issueLabelOpenclaw": "openclaw",
  "issueLabelWeb": "web",
  "issueLabelTrending": "trending",
  "issueLabelHn": "hn",
  "issueLabelPh": "ph",
  "issueLabelArxiv": "arxiv",
  "issueLabelHf": "hf",
  "issueLabelCommunity": "community",
  "issueTitleCli": "📊 Bản Tin Cộng Đồng Công Cụ CLI AI",
  "issueTitleOpenclaw": "🦞 Bản Tin Hệ Sinh Thái OpenClaw",
  "issueTitleWeb": "🌐 Báo Cáo Nội Dung AI Chính Thức",
  "issueTitleTrending": "📈 Xu Hướng Mã Nguồn Mở AI",
  "issueTitleHn": "📰 Bản Tin AI Trên Hacker News",
  "issueTitlePh": "🚀 Tóm tắt AI từ Product Hunt",
  "issueTitleArxiv": "📚 Tóm tắt Nghiên cứu AI từ ArXiv",
  "issueTitleHf": "🤗 Mô hình Nổi bật trên Hugging Face",
  "issueTitleCommunity": "💬 Tóm tắt AI từ Cộng đồng Công nghệ",
  "autoGen": "Bản tóm tắt này được tạo tự động bởi",
  "reportLabelAiCli": "Tóm tắt Công cụ CLI AI",
  "reportLabelAiAgents": "Tóm tắt Hệ sinh thái Tác nhân AI",
  "reportLabelAiWeb": "Báo cáo Nội dung AI Chính thức",
  "reportLabelAiTrending": "Xu hướng AI Mã nguồn Mở",
  "reportLabelAiHn": "Tóm tắt Cộng đồng AI trên Hacker News",
  "reportLabelAiPh": "Tóm tắt Sản phẩm AI từ Product Hunt",
  "reportLabelAiArxiv": "Tóm tắt Nghiên cứu AI từ ArXiv",
  "reportLabelAiHf": "Tóm tắt Mô hình Nổi bật trên Hugging Face",
  "reportLabelAiCommunity": "Tóm tắt AI từ Cộng đồng Công nghệ",
  "reportLabelAiWeekly": "Tóm tắt Công cụ AI Hàng tuần",
  "reportLabelAiMonthly": "Tóm tắt Công cụ AI Hàng tháng",
  "notifyCli": "Công Cụ CLI AI",
  "notifyAgents": "Hệ Sinh Thái Tác Nhân AI",
  "notifyWeb": "Cập Nhật Chính Thức",
  "notifyTrending": "Xu Hướng GitHub",
  "notifyHn": "Cộng Đồng HN",
  "notifyPh": "Product Hunt",
  "notifyArxiv": "Nghiên cứu ArXiv",
  "notifyHf": "Mô hình HF",
  "notifyCommunity": "Cộng đồng Công nghệ",
  "notifyWeekly": "Công Cụ AI Hàng Tuần",
  "notifyMonthly": "Công Cụ AI Hàng Tháng",
  "notifyFooter": "Được hỗ trợ bởi Big Model Radar",
  "formatItemAuthor": "Tác giả",
  "formatItemCreated": "Đã tạo",
  "formatItemUpdated": "Đã cập nhật",
  "formatItemComments": "Bình luận",
  "formatItemUrl": "URL",
  "formatItemSummary": "Tóm tắt",
  "sampleNote": "(Tổng số: {total} mục; hiển thị {sampled} mục hàng đầu theo số lượng bình luận)",
  "sampleNoteAll": "(Tổng số: {total} mục)",
  "noneStr": "Không",
  "unableToExtract": "(Không thể trích xuất nội dung văn bản)",
  "issueTruncation": "\n\n---\n> ⚠️ Nội dung vượt quá giới hạn GitHub Issue. Vui lòng xem tệp Markdown đã được gửi để có báo cáo đầy đủ.",
  "digestTruncation": "...[đã cắt]",
  "weeklyTruncation": "...[đã cắt]",
  "weeklyMeta": "> Phạm vi: {range} | Được tạo: {utcStr} UTC",
  "monthlyMeta": "> Nguồn: {sources} | Được tạo: {utcStr} UTC",
  "sourceLabelWeekly": "{n} báo cáo hàng tuần",
  "sourceLabelDailySampled": "{n} báo cáo hàng ngày (lấy mẫu mỗi 4 ngày)",
  "manifestCli": "Bản Tin Công Cụ CLI AI",
  "manifestAgents": "Bản Tin Hệ Sinh Thái Tác Nhân AI",
  "manifestWeb": "Báo Cáo Nội Dung AI Chính Thức",
  "manifestTrending": "Xu Hướng Mã Nguồn Mở AI",
  "manifestHn": "Bản Tin Cộng Đồng AI Trên Hacker News",
  "manifestWeekly": "Bản Tin Công Cụ AI Hàng Tuần",
  "manifestMonthly": "Bản Tin Công Cụ AI Hàng Tháng",
  "autoGenFooter": ".",
  "hnMeta": "> Nguồn: [Hacker News](https://news.ycombinator.com/) | {count} tin | Tạo lúc: {utcStr} UTC\n\n---\n\n",
  "phMeta": "> Nguồn: [Product Hunt](https://www.producthunt.com/) | {count} sản phẩm | Tạo lúc: {utcStr} UTC\n\n---\n\n",
  "arxivMeta": "> Nguồn: [ArXiv](https://arxiv.org/) (cs.AI, cs.CL, cs.LG) | {count} bài báo | Tạo lúc: {utcStr} UTC\n\n---\n\n",
  "hfMeta": "> Nguồn: [Hugging Face Hub](https://huggingface.co/) | {count} mô hình | Tạo lúc: {utcStr} UTC\n\n---\n\n",
  "communityMeta": "> Nguồn: [Dev.to](https://dev.to/) ({devto} bài viết) + [Lobste.rs](https://lobste.rs/) ({lobsters} tin) | Tạo lúc: {utcStr} UTC\n\n---\n\n",
  "trendingMeta": "> {sources} | Tạo lúc: {utcStr} UTC\n\n---\n\n",
  "webSourcesAnthropic": "- Anthropic: [anthropic.com](https://www.anthropic.com) — {new} bài viết mới (tổng sitemap: {total})",
  "webSourcesOpenai": "- OpenAI: [openai.com](https://openai.com) — {new} bài viết mới (tổng sitemap: {total})",
  "webIssueTitle": "🌐 Báo cáo Nội dung AI Chính thức {dateStr}",
  "webIssueTitleFirstCrawl": "🌐 Báo cáo Nội dung AI Chính thức {dateStr} (Thu thập Đầy đủ Lần đầu)",
  "notifySuffixMonthly": " Hàng tháng",
  "notifySuffixWeekly": " Hàng tuần",
  "notifyFooterLinks": "<a href=\"{pagesUrl}\">🌐 Web UI</a>  ·  <a href=\"{pagesUrl}/feed.xml\">⊕ RSS</a>",
  "feishuFooterLinks": "[🌐 Web UI]({pagesUrl})  ·  [⊕ RSS]({pagesUrl}/feed.xml)",
  "trendingFetchFailed": "(Không thể lấy danh sách xu hướng GitHub hôm nay)",
  "searchNoResults": "(Không có kết quả tìm kiếm)",
  "$schema": "../locale-schema.json"
}
