{
  "_meta": {
    "name": "French",
    "nativeName": "Français",
    "code": "fr-FR"
  },
  "noActivity": "Aucune activité au cours des dernières 24 heures.",
  "summaryFailed": "⚠️ Échec de la génération du résumé.",
  "skillsFailed": "⚠️ Échec de la génération du résumé des compétences.",
  "trendingNoData": "⚠️ Données de tendances indisponibles, impossible de générer le rapport.",
  "trendingFailed": "⚠️ Échec de la génération du rapport de tendances.",
  "webNoNewContent": "Aucun nouveau contenu trouvé.",
  "webFetchFailed": "⚠️ Échec de la récupération du contenu web.",
  "hnFetchFailed": "⚠️ Échec de la récupération des données HN.",
  "cliTitle": "Digest Communautaire des Outils CLI IA",
  "cliMeta": "> Généré : {utcStr} UTC | Outils couverts : {count}",
  "cliSkillsHeading": "## Points Forts des Compétences Claude Code",
  "cliSkillsSource": "> Source : [{repo}](https://github.com/{repo})",
  "cliComparison": "## Comparaison entre Outils",
  "cliDetail": "## Rapports par Outil",
  "openclawTitle": "Digest de l'Écosystème OpenClaw",
  "openclawMeta": "> Issues : {issues} | PRs : {prs} | Projets couverts : {projects} | Généré : {utcStr} UTC",
  "openclawDeepDive": "## Analyse Approfondie d'OpenClaw",
  "openclawComparison": "## Comparaison entre Écosystèmes",
  "openclawPeers": "## Rapports des Projets Pairs",
  "webTitle": "Rapport Officiel du Contenu IA",
  "webMeta": "> {mode} | Nouveau contenu : {count} articles | Généré : {utcStr} UTC",
  "webFirstCrawl": "First full crawl",
  "webTodayUpdate": "Today's update",
  "webNewContent": "New content: {count} articles",
  "webGenerated": "Generated: {utcStr} UTC",
  "webSourcesHeader": "Sources :",
  "webFirstCrawlNote": "Il s'agit du premier crawl complet. Veuillez vous concentrer sur le paysage global du contenu, le contexte historique et les thèmes principaux de chaque site, plutôt que sur les articles individuels.",
  "webIncrementalNote": "Il s'agit d'une mise à jour incrémentielle. Veuillez vous concentrer sur le nouveau contenu du jour et évaluer sa signification stratégique dans son contexte.",
  "trendingTitle": "Tendances Open Source en IA",
  "trendingSources": "> Sources : GitHub Trending + GitHub Search API | Généré : {utcStr} UTC",
  "hnTitle": "Digest Communautaire IA de Hacker News",
  "phTitle": "Product Hunt AI Products Digest",
  "arxivTitle": "ArXiv AI Research Digest",
  "hfTitle": "Hugging Face Trending Models Digest",
  "communityTitle": "Tech Community AI Digest",
  "weeklyTitle": "Rapport Hebdomadaire de l'Écosystème d'Outils IA",
  "weeklyCoverage": "Coverage",
  "monthlyTitle": "Rapport Mensuel de l'Écosystème d'Outils IA",
  "issueLabelCli": "digest",
  "issueLabelOpenclaw": "openclaw",
  "issueLabelWeb": "web",
  "issueLabelTrending": "trending",
  "issueLabelHn": "hn",
  "issueLabelPh": "ph-en",
  "issueLabelArxiv": "arxiv-en",
  "issueLabelHf": "hf-en",
  "issueLabelCommunity": "community-en",
  "issueTitleCli": "📊 Digest Communautaire des Outils CLI IA",
  "issueTitleOpenclaw": "🦞 Digest de l'Écosystème OpenClaw",
  "issueTitleWeb": "🌐 Rapport Officiel du Contenu IA",
  "issueTitleTrending": "📈 Tendances Open Source en IA",
  "issueTitleHn": "📰 Digest IA de Hacker News",
  "issueTitlePh": "🚀 Product Hunt AI Digest",
  "issueTitleArxiv": "📚 ArXiv AI Research Digest",
  "issueTitleHf": "🤗 Hugging Face Trending Models",
  "issueTitleCommunity": "💬 Tech Community AI Digest",
  "autoGen": "This digest is auto-generated by",
  "reportLabelAiCli": "AI CLI Tools Digest",
  "reportLabelAiAgents": "AI Agents Ecosystem Digest",
  "reportLabelAiWeb": "Official AI Content Report",
  "reportLabelAiTrending": "AI Open Source Trends",
  "reportLabelAiHn": "Hacker News AI Community Digest",
  "reportLabelAiPh": "Product Hunt AI Products Digest",
  "reportLabelAiArxiv": "ArXiv AI Research Digest",
  "reportLabelAiHf": "Hugging Face Trending Models Digest",
  "reportLabelAiCommunity": "Tech Community AI Digest",
  "reportLabelAiWeekly": "AI Tools Weekly Digest",
  "reportLabelAiMonthly": "AI Tools Monthly Digest",
  "notifyCli": "Outils CLI IA",
  "notifyAgents": "Écosystème des Agents IA",
  "notifyWeb": "Actualités Officielles",
  "notifyTrending": "Tendances GitHub",
  "notifyHn": "Communauté HN",
  "notifyPh": "Product Hunt",
  "notifyArxiv": "ArXiv Research",
  "notifyHf": "HF Models",
  "notifyCommunity": "Tech Community",
  "notifyWeekly": "Outils IA Hebdo",
  "notifyMonthly": "Outils IA Mensuel",
  "notifyFooter": "Powered by Big Model Radar",
  "formatItemAuthor": "Auteur",
  "formatItemCreated": "Créé",
  "formatItemUpdated": "Mis à jour",
  "formatItemComments": "Commentaires",
  "formatItemUrl": "URL",
  "formatItemSummary": "Résumé",
  "sampleNote": "(Total : {total} éléments ; affichage des {sampled} premiers par nombre de commentaires)",
  "sampleNoteAll": "(Total : {total} éléments)",
  "noneStr": "Aucun",
  "unableToExtract": "(Impossible d'extraire le contenu textuel)",
  "issueTruncation": "\n\n---\n> ⚠️ Le contenu dépasse la limite de GitHub Issue. Consultez le fichier Markdown soumis pour le rapport complet.",
  "digestTruncation": "...[tronqué]",
  "weeklyTruncation": "...[tronqué]",
  "weeklyMeta": "> Couverture : {range} | Généré : {utcStr} UTC",
  "monthlyMeta": "> Sources : {sources} | Généré : {utcStr} UTC",
  "sourceLabelWeekly": "{n} rapports hebdomadaires",
  "sourceLabelDailySampled": "{n} rapports quotidiens (échantillonnés tous les 4 jours)",
  "manifestCli": "Digest des Outils CLI IA",
  "manifestAgents": "Digest de l'Écosystème des Agents IA",
  "manifestWeb": "Rapport Officiel du Contenu IA",
  "manifestTrending": "Tendances Open Source en IA",
  "manifestHn": "Digest IA de Hacker News",
  "manifestWeekly": "Digest Hebdomadaire des Outils IA",
  "manifestMonthly": "Digest Mensuel des Outils IA",
  "autoGenFooter": ".",
  "hnMeta": "> Source: [Hacker News](https://news.ycombinator.com/) | {count} stories | Generated: {utcStr} UTC\n\n---\n\n",
  "phMeta": "> Source: [Product Hunt](https://www.producthunt.com/) | {count} products | Generated: {utcStr} UTC\n\n---\n\n",
  "arxivMeta": "> Source: [ArXiv](https://arxiv.org/) (cs.AI, cs.CL, cs.LG) | {count} papers | Generated: {utcStr} UTC\n\n---\n\n",
  "hfMeta": "> Source: [Hugging Face Hub](https://huggingface.co/) | {count} models | Generated: {utcStr} UTC\n\n---\n\n",
  "communityMeta": "> Sources: [Dev.to](https://dev.to/) ({devto} articles) + [Lobste.rs](https://lobste.rs/) ({lobsters} stories) | Generated: {utcStr} UTC\n\n---\n\n",
  "trendingMeta": "> {sources} | Generated: {utcStr} UTC\n\n---\n\n",
  "webSourcesAnthropic": "- Anthropic: [anthropic.com](https://www.anthropic.com) — {new} new articles (sitemap total: {total})",
  "webSourcesOpenai": "- OpenAI: [openai.com](https://openai.com) — {new} new articles (sitemap total: {total})",
  "webIssueTitle": "🌐 Official AI Content Report {dateStr}",
  "webIssueTitleFirstCrawl": "🌐 Official AI Content Report {dateStr} (First Crawl)",
  "notifySuffixMonthly": " Monthly",
  "notifySuffixWeekly": " Weekly",
  "notifyFooterLinks": "<a href=\"{pagesUrl}\">🌐 Web UI</a>  ·  <a href=\"{pagesUrl}/feed.xml\">⊕ RSS</a>",
  "feishuFooterLinks": "[🌐 Web UI]({pagesUrl})  ·  [⊕ RSS]({pagesUrl}/feed.xml)",
  "trendingFetchFailed": "(Unable to fetch today's GitHub Trending list)",
  "searchNoResults": "(No search results)"
}
