{
  "_meta": {
    "name": "Japanese",
    "nativeName": "日本語",
    "code": "ja-JP"
  },
  "noActivity": "過去24時間にアクティビティはありません。",
  "summaryFailed": "⚠️ サマリーの生成に失敗しました。",
  "skillsFailed": "⚠️ スキルサマリーの生成に失敗しました。",
  "trendingNoData": "⚠️ トレンドデータが利用できないため、レポートを生成できません。",
  "trendingFailed": "⚠️ トレンドレポートの生成に失敗しました。",
  "webNoNewContent": "新しいコンテンツは見つかりませんでした。",
  "webFetchFailed": "⚠️ Webコンテンツの取得に失敗しました。",
  "hnFetchFailed": "⚠️ HNの取得に失敗しました。",
  "cliTitle": "AI CLIツール コミュニティダイジェスト",
  "cliMeta": "> 生成: {utcStr} UTC | 対象ツール数: {count}",
  "cliSkillsHeading": "## Claude Codeスキルハイライト",
  "cliSkillsSource": "> ソース: [{repo}](https://github.com/{repo})",
  "cliComparison": "## ツール間比較",
  "cliDetail": "## ツール別レポート",
  "openclawTitle": "OpenClaw エコシステムダイジェスト",
  "openclawMeta": "> Issues: {issues} | PRs: {prs} | 対象プロジェクト数: {projects} | 生成: {utcStr} UTC",
  "openclawDeepDive": "## OpenClaw 詳細分析",
  "openclawComparison": "## エコシステム間比較",
  "openclawPeers": "## ピアプロジェクトレポート",
  "webTitle": "公式AIコンテンツレポート",
  "webMeta": "> {mode} | 新着コンテンツ: {count} 記事 | 生成: {utcStr} UTC",
  "webFirstCrawl": "初回フルクロール",
  "webTodayUpdate": "今日の更新",
  "webNewContent": "新着コンテンツ: {count} 件",
  "webGenerated": "生成日時: {utcStr} UTC",
  "webSourcesHeader": "ソース:",
  "webFirstCrawlNote": "これは初回のフルクロールです。個々の記事ではなく、各サイトの全体的なコンテンツの概要、歴史的背景、コアテーマに焦点を当ててください。",
  "webIncrementalNote": "これは増分更新です。本日の新しいコンテンツに焦点を当て、その戦略的意義を文脈の中で評価してください。",
  "trendingTitle": "AIオープンソーストレンド",
  "trendingSources": "> ソース: GitHub Trending + GitHub Search API | 生成: {utcStr} UTC",
  "hnTitle": "Hacker News AIコミュニティダイジェスト",
  "phTitle": "Product Hunt AI製品ダイジェスト",
  "arxivTitle": "ArXiv AI研究ダイジェスト",
  "hfTitle": "Hugging Face 注目モデルダイジェスト",
  "communityTitle": "テックコミュニティ AIダイジェスト",
  "weeklyTitle": "AIツールエコシステム週刊レポート",
  "weeklyCoverage": "対象期間",
  "monthlyTitle": "AIツールエコシステム月間レポート",
  "issueLabelCli": "digest",
  "issueLabelOpenclaw": "openclaw",
  "issueLabelWeb": "web",
  "issueLabelTrending": "trending",
  "issueLabelHn": "hn",
  "issueLabelPh": "ph",
  "issueLabelArxiv": "arxiv",
  "issueLabelHf": "hf",
  "issueLabelCommunity": "community",
  "issueTitleCli": "📊 AI CLIツール コミュニティダイジェスト",
  "issueTitleOpenclaw": "🦞 OpenClaw エコシステムダイジェスト",
  "issueTitleWeb": "🌐 公式AIコンテンツレポート",
  "issueTitleTrending": "📈 AIオープンソーストレンド",
  "issueTitleHn": "📰 Hacker News AIダイジェスト",
  "issueTitlePh": "🚀 Product Hunt AIダイジェスト",
  "issueTitleArxiv": "📚 ArXiv AI研究ダイジェスト",
  "issueTitleHf": "🤗 Hugging Face 注目モデル",
  "issueTitleCommunity": "💬 テックコミュニティ AIダイジェスト",
  "autoGen": "このダイジェストは以下により自動生成されています：",
  "reportLabelAiCli": "AI CLIツールダイジェスト",
  "reportLabelAiAgents": "AIエージェントエコシステムダイジェスト",
  "reportLabelAiWeb": "AI公式コンテンツレポート",
  "reportLabelAiTrending": "AIオープンソース動向",
  "reportLabelAiHn": "Hacker News AIコミュニティダイジェスト",
  "reportLabelAiPh": "Product Hunt AI製品ダイジェスト",
  "reportLabelAiArxiv": "ArXiv AI研究ダイジェスト",
  "reportLabelAiHf": "Hugging Face 注目モデルダイジェスト",
  "reportLabelAiCommunity": "テックコミュニティ AIダイジェスト",
  "reportLabelAiWeekly": "AIツール週報",
  "reportLabelAiMonthly": "AIツール月報",
  "notifyCli": "AI CLIツール",
  "notifyAgents": "AIエージェントエコシステム",
  "notifyWeb": "公式アップデート",
  "notifyTrending": "GitHubトレンド",
  "notifyHn": "HNコミュニティ",
  "notifyPh": "Product Hunt",
  "notifyArxiv": "ArXiv 論文",
  "notifyHf": "HF モデル",
  "notifyCommunity": "テックコミュニティ",
  "notifyWeekly": "AIツール週刊",
  "notifyMonthly": "AIツール月間",
  "notifyFooter": "Powered by Big Model Radar",
  "formatItemAuthor": "作成者",
  "formatItemCreated": "作成日",
  "formatItemUpdated": "更新日",
  "formatItemComments": "コメント",
  "formatItemUrl": "URL",
  "formatItemSummary": "概要",
  "sampleNote": "（全 {total} 件中、コメント数上位 {sampled} 件を表示）",
  "sampleNoteAll": "（全 {total} 件）",
  "noneStr": "なし",
  "unableToExtract": "（テキストコンテンツを抽出できません）",
  "issueTruncation": "\n\n---\n> ⚠️ コンテンツがGitHub Issueの上限を超えています。完全なレポートは提出されたMarkdownファイルをご覧ください。",
  "digestTruncation": "...[省略]",
  "weeklyTruncation": "...[省略]",
  "weeklyMeta": "> 対象期間: {range} | 生成: {utcStr} UTC",
  "monthlyMeta": "> ソース: {sources} | 生成: {utcStr} UTC",
  "sourceLabelWeekly": "{n} 件の週刊レポート",
  "sourceLabelDailySampled": "{n} 件の日次レポート（4日ごとにサンプリング）",
  "manifestCli": "AI CLIツールダイジェスト",
  "manifestAgents": "AIエージェントエコシステムダイジェスト",
  "manifestWeb": "公式AIコンテンツレポート",
  "manifestTrending": "AIオープンソーストレンド",
  "manifestHn": "Hacker News AIコミュニティダイジェスト",
  "manifestWeekly": "AIツール週刊ダイジェスト",
  "manifestMonthly": "AIツール月間ダイジェスト",
  "autoGenFooter": ".",
  "hnMeta": "> 出典: [Hacker News](https://news.ycombinator.com/) | {count} 件 | 生成: {utcStr} UTC\n\n---\n\n",
  "phMeta": "> 出典: [Product Hunt](https://www.producthunt.com/) | {count} 製品 | 生成: {utcStr} UTC\n\n---\n\n",
  "arxivMeta": "> 出典: [ArXiv](https://arxiv.org/) (cs.AI, cs.CL, cs.LG) | {count} 論文 | 生成: {utcStr} UTC\n\n---\n\n",
  "hfMeta": "> 出典: [Hugging Face Hub](https://huggingface.co/) | {count} モデル | 生成: {utcStr} UTC\n\n---\n\n",
  "communityMeta": "> 出典: [Dev.to](https://dev.to/) ({devto} 件) + [Lobste.rs](https://lobste.rs/) ({lobsters} 件) | 生成: {utcStr} UTC\n\n---\n\n",
  "trendingMeta": "> {sources} | 生成: {utcStr} UTC\n\n---\n\n",
  "webSourcesAnthropic": "- Anthropic: [anthropic.com](https://www.anthropic.com) — 新着 {new} 件（sitemap合計: {total}）",
  "webSourcesOpenai": "- OpenAI: [openai.com](https://openai.com) — 新着 {new} 件（sitemap合計: {total}）",
  "webIssueTitle": "🌐 AI公式コンテンツレポート {dateStr}",
  "webIssueTitleFirstCrawl": "🌐 AI公式コンテンツレポート {dateStr}（初回フルクロール）",
  "notifySuffixMonthly": " 月報",
  "notifySuffixWeekly": " 週報",
  "notifyFooterLinks": "<a href=\"{pagesUrl}\">🌐 Web UI</a>  ·  <a href=\"{pagesUrl}/feed.xml\">⊕ RSS</a>",
  "feishuFooterLinks": "[🌐 Web UI]({pagesUrl})  ·  [⊕ RSS]({pagesUrl}/feed.xml)",
  "trendingFetchFailed": "（今日のGitHub Trendingリストを取得できませんでした）",
  "searchNoResults": "（検索結果なし）",
  "$schema": "../locale-schema.json"
}
