{
  "_meta": {
    "name": "Thai",
    "nativeName": "ไทย",
    "code": "th-TH"
  },
  "noActivity": "ไม่มีกิจกรรมใน 24 ชั่วโมงที่ผ่านมา",
  "summaryFailed": "⚠️ การสร้างสรุปผลล้มเหลว",
  "skillsFailed": "⚠️ การสร้างสรุปทักษะล้มเหลว",
  "trendingNoData": "⚠️ ไม่มีข้อมูลเทรนด์ ไม่สามารถสร้างรายงานได้",
  "trendingFailed": "⚠️ การสร้างรายงานเทรนด์ล้มเหลว",
  "webNoNewContent": "ไม่พบเนื้อหาใหม่",
  "webFetchFailed": "⚠️ การดึงข้อมูลเว็บล้มเหลว",
  "hnFetchFailed": "⚠️ การดึงข้อมูล HN ล้มเหลว",
  "cliTitle": "ไดเจสต์ชุมชนเครื่องมือ CLI AI",
  "cliMeta": "> สร้างเมื่อ: {utcStr} UTC | เครื่องมือที่ครอบคลุม: {count} รายการ",
  "cliSkillsHeading": "## จุดเด่นทักษะ Claude Code",
  "cliSkillsSource": "> แหล่งที่มา: [{repo}](https://github.com/{repo})",
  "cliComparison": "## การเปรียบเทียบข้ามเครื่องมือ",
  "cliDetail": "## รายงานแยกตามเครื่องมือ",
  "openclawTitle": "ไดเจสต์ระบบนิเวศ OpenClaw",
  "openclawMeta": "> Issues: {issues} | PRs: {prs} | โปรเจกต์ที่ครอบคลุม: {projects} | สร้างเมื่อ: {utcStr} UTC",
  "openclawDeepDive": "## เจาะลึก OpenClaw",
  "openclawComparison": "## การเปรียบเทียบข้ามระบบนิเวศ",
  "openclawPeers": "## รายงานโปรเจกต์ที่เกี่ยวข้อง",
  "webTitle": "รายงานเนื้อหา AI อย่างเป็นทางการ",
  "webMeta": "> {mode} | เนื้อหาใหม่: {count} บทความ | สร้างเมื่อ: {utcStr} UTC",
  "webFirstCrawl": "First full crawl",
  "webTodayUpdate": "Today's update",
  "webNewContent": "New content: {count} articles",
  "webGenerated": "Generated: {utcStr} UTC",
  "webSourcesHeader": "แหล่งที่มา:",
  "webFirstCrawlNote": "นี่เป็นการรวบรวมข้อมูลแบบเต็มครั้งแรก โปรดมุ่งเน้นที่ภาพรวมของเนื้อหา บริบททางประวัติศาสตร์ และธีมหลักของแต่ละเว็บไซต์ แทนที่จะเป็นบทความแต่ละบทความ",
  "webIncrementalNote": "นี่เป็นการอัปเดตเพิ่มเติม โปรดมุ่งเน้นที่เนื้อหาใหม่ของวันนี้และประเมินความสำคัญเชิงกลยุทธ์ในบริบท",
  "trendingTitle": "เทรนด์โอเพนซอร์ส AI",
  "trendingSources": "> แหล่งที่มา: GitHub Trending + GitHub Search API | สร้างเมื่อ: {utcStr} UTC",
  "hnTitle": "ไดเจสต์ชุมชน AI จาก Hacker News",
  "phTitle": "Product Hunt AI Products Digest",
  "arxivTitle": "ArXiv AI Research Digest",
  "hfTitle": "Hugging Face Trending Models Digest",
  "communityTitle": "Tech Community AI Digest",
  "weeklyTitle": "รายงานประจำสัปดาห์ระบบนิเวศเครื่องมือ AI",
  "weeklyCoverage": "Coverage",
  "monthlyTitle": "รายงานประจำเดือนระบบนิเวศเครื่องมือ AI",
  "issueLabelCli": "digest",
  "issueLabelOpenclaw": "openclaw",
  "issueLabelWeb": "web",
  "issueLabelTrending": "trending",
  "issueLabelHn": "hn",
  "issueLabelPh": "ph-en",
  "issueLabelArxiv": "arxiv-en",
  "issueLabelHf": "hf-en",
  "issueLabelCommunity": "community-en",
  "issueTitleCli": "📊 ไดเจสต์ชุมชนเครื่องมือ CLI AI",
  "issueTitleOpenclaw": "🦞 ไดเจสต์ระบบนิเวศ OpenClaw",
  "issueTitleWeb": "🌐 รายงานเนื้อหา AI อย่างเป็นทางการ",
  "issueTitleTrending": "📈 เทรนด์โอเพนซอร์ส AI",
  "issueTitleHn": "📰 ไดเจสต์ AI จาก Hacker News",
  "issueTitlePh": "🚀 Product Hunt AI Digest",
  "issueTitleArxiv": "📚 ArXiv AI Research Digest",
  "issueTitleHf": "🤗 Hugging Face Trending Models",
  "issueTitleCommunity": "💬 Tech Community AI Digest",
  "autoGen": "This digest is auto-generated by",
  "reportLabelAiCli": "AI CLI Tools Digest",
  "reportLabelAiAgents": "AI Agents Ecosystem Digest",
  "reportLabelAiWeb": "Official AI Content Report",
  "reportLabelAiTrending": "AI Open Source Trends",
  "reportLabelAiHn": "Hacker News AI Community Digest",
  "reportLabelAiPh": "Product Hunt AI Products Digest",
  "reportLabelAiArxiv": "ArXiv AI Research Digest",
  "reportLabelAiHf": "Hugging Face Trending Models Digest",
  "reportLabelAiCommunity": "Tech Community AI Digest",
  "reportLabelAiWeekly": "AI Tools Weekly Digest",
  "reportLabelAiMonthly": "AI Tools Monthly Digest",
  "notifyCli": "เครื่องมือ CLI AI",
  "notifyAgents": "ระบบนิเวศเอเยนต์ AI",
  "notifyWeb": "อัปเดตอย่างเป็นทางการ",
  "notifyTrending": "เทรนด์ GitHub",
  "notifyHn": "ชุมชน HN",
  "notifyPh": "Product Hunt",
  "notifyArxiv": "ArXiv Research",
  "notifyHf": "HF Models",
  "notifyCommunity": "Tech Community",
  "notifyWeekly": "เครื่องมือ AI รายสัปดาห์",
  "notifyMonthly": "เครื่องมือ AI รายเดือน",
  "notifyFooter": "ขับเคลื่อนโดย Big Model Radar",
  "formatItemAuthor": "ผู้เขียน",
  "formatItemCreated": "สร้างเมื่อ",
  "formatItemUpdated": "อัปเดตเมื่อ",
  "formatItemComments": "ความคิดเห็น",
  "formatItemUrl": "URL",
  "formatItemSummary": "สรุป",
  "sampleNote": "(รวมทั้งหมด: {total} รายการ; แสดง {sampled} รายการแรกตามจำนวนความคิดเห็น)",
  "sampleNoteAll": "(รวมทั้งหมด: {total} รายการ)",
  "noneStr": "ไม่มี",
  "unableToExtract": "(ไม่สามารถดึงเนื้อหาข้อความได้)",
  "issueTruncation": "\n\n---\n> ⚠️ เนื้อหาเกินขีดจำกัดของ GitHub Issue โปรดดูไฟล์ Markdown ที่ส่งมาสำหรับรายงานฉบับเต็ม",
  "digestTruncation": "...[ถูกตัด]",
  "weeklyTruncation": "...[ถูกตัด]",
  "weeklyMeta": "> ขอบเขต: {range} | สร้างเมื่อ: {utcStr} UTC",
  "monthlyMeta": "> แหล่งที่มา: {sources} | สร้างเมื่อ: {utcStr} UTC",
  "sourceLabelWeekly": "รายงานประจำสัปดาห์ {n} รายการ",
  "sourceLabelDailySampled": "รายงานประจำวัน {n} รายการ (สุ่มตัวอย่างทุก 4 วัน)",
  "manifestCli": "ไดเจสต์เครื่องมือ CLI AI",
  "manifestAgents": "ไดเจสต์ระบบนิเวศเอเยนต์ AI",
  "manifestWeb": "รายงานเนื้อหา AI อย่างเป็นทางการ",
  "manifestTrending": "เทรนด์โอเพนซอร์ส AI",
  "manifestHn": "ไดเจสต์ชุมชน AI จาก Hacker News",
  "manifestWeekly": "ไดเจสต์เครื่องมือ AI รายสัปดาห์",
  "manifestMonthly": "ไดเจสต์เครื่องมือ AI รายเดือน",
  "autoGenFooter": ".",
  "hnMeta": "> Source: [Hacker News](https://news.ycombinator.com/) | {count} stories | Generated: {utcStr} UTC\n\n---\n\n",
  "phMeta": "> Source: [Product Hunt](https://www.producthunt.com/) | {count} products | Generated: {utcStr} UTC\n\n---\n\n",
  "arxivMeta": "> Source: [ArXiv](https://arxiv.org/) (cs.AI, cs.CL, cs.LG) | {count} papers | Generated: {utcStr} UTC\n\n---\n\n",
  "hfMeta": "> Source: [Hugging Face Hub](https://huggingface.co/) | {count} models | Generated: {utcStr} UTC\n\n---\n\n",
  "communityMeta": "> Sources: [Dev.to](https://dev.to/) ({devto} articles) + [Lobste.rs](https://lobste.rs/) ({lobsters} stories) | Generated: {utcStr} UTC\n\n---\n\n",
  "trendingMeta": "> {sources} | Generated: {utcStr} UTC\n\n---\n\n",
  "webSourcesAnthropic": "- Anthropic: [anthropic.com](https://www.anthropic.com) — {new} new articles (sitemap total: {total})",
  "webSourcesOpenai": "- OpenAI: [openai.com](https://openai.com) — {new} new articles (sitemap total: {total})",
  "webIssueTitle": "🌐 Official AI Content Report {dateStr}",
  "webIssueTitleFirstCrawl": "🌐 Official AI Content Report {dateStr} (First Crawl)",
  "notifySuffixMonthly": " Monthly",
  "notifySuffixWeekly": " Weekly",
  "notifyFooterLinks": "<a href=\"{pagesUrl}\">🌐 Web UI</a>  ·  <a href=\"{pagesUrl}/feed.xml\">⊕ RSS</a>",
  "feishuFooterLinks": "[🌐 Web UI]({pagesUrl})  ·  [⊕ RSS]({pagesUrl}/feed.xml)",
  "trendingFetchFailed": "(Unable to fetch today's GitHub Trending list)",
  "searchNoResults": "(No search results)"
}
