{
  "_meta": {
    "name": "Polish",
    "nativeName": "Polski",
    "code": "pl-PL"
  },
  "noActivity": "Brak aktywności w ciągu ostatnich 24 godzin.",
  "summaryFailed": "⚠️ Generowanie podsumowania nie powiodło się.",
  "skillsFailed": "⚠️ Generowanie podsumowania umiejętności nie powiodło się.",
  "trendingNoData": "⚠️ Dane trendów niedostępne, nie można wygenerować raportu.",
  "trendingFailed": "⚠️ Generowanie raportu trendów nie powiodło się.",
  "webNoNewContent": "Nie znaleziono nowych treści.",
  "webFetchFailed": "⚠️ Pobieranie treści internetowych nie powiodło się.",
  "hnFetchFailed": "⚠️ Pobieranie danych HN nie powiodło się.",
  "cliTitle": "Przegląd Społeczności Narzędzi CLI AI",
  "cliMeta": "> Wygenerowano: {utcStr} UTC | Objęte narzędzia: {count}",
  "cliSkillsHeading": "## Najważniejsze Umiejętności Claude Code",
  "cliSkillsSource": "> Źródło: [{repo}](https://github.com/{repo})",
  "cliComparison": "## Porównanie Między Narzędziami",
  "cliDetail": "## Raporty Poszczególnych Narzędzi",
  "openclawTitle": "Przegląd Ekosystemu OpenClaw",
  "openclawMeta": "> Issues: {issues} | PR: {prs} | Objęte projekty: {projects} | Wygenerowano: {utcStr} UTC",
  "openclawDeepDive": "## Dogłębna Analiza OpenClaw",
  "openclawComparison": "## Porównanie Między Ekosystemami",
  "openclawPeers": "## Raporty Projektów Partnerskich",
  "webTitle": "Oficjalny Raport Treści AI",
  "webMeta": "> {mode} | Nowe treści: {count} artykułów | Wygenerowano: {utcStr} UTC",
  "webFirstCrawl": "First full crawl",
  "webTodayUpdate": "Today's update",
  "webNewContent": "New content: {count} articles",
  "webGenerated": "Generated: {utcStr} UTC",
  "webSourcesHeader": "Źródła:",
  "webFirstCrawlNote": "To jest pierwsze pełne skanowanie. Proszę skupić się na ogólnym krajobrazie treści, kontekście historycznym i głównych tematach każdej witryny, a nie na poszczególnych artykułach.",
  "webIncrementalNote": "To jest aktualizacja przyrostowa. Proszę skupić się na nowej zawartości z dzisiaj i ocenić jej strategiczne znaczenie w kontekście.",
  "trendingTitle": "Trendy Open Source w AI",
  "trendingSources": "> Źródła: GitHub Trending + GitHub Search API | Wygenerowano: {utcStr} UTC",
  "hnTitle": "Przegląd Społeczności AI z Hacker News",
  "phTitle": "Product Hunt AI Products Digest",
  "arxivTitle": "ArXiv AI Research Digest",
  "hfTitle": "Hugging Face Trending Models Digest",
  "communityTitle": "Tech Community AI Digest",
  "weeklyTitle": "Tygodniowy Raport Ekosystemu Narzędzi AI",
  "weeklyCoverage": "Coverage",
  "monthlyTitle": "Miesięczny Raport Ekosystemu Narzędzi AI",
  "issueLabelCli": "digest",
  "issueLabelOpenclaw": "openclaw",
  "issueLabelWeb": "web",
  "issueLabelTrending": "trending",
  "issueLabelHn": "hn",
  "issueLabelPh": "ph-en",
  "issueLabelArxiv": "arxiv-en",
  "issueLabelHf": "hf-en",
  "issueLabelCommunity": "community-en",
  "issueTitleCli": "📊 Przegląd Społeczności Narzędzi CLI AI",
  "issueTitleOpenclaw": "🦞 Przegląd Ekosystemu OpenClaw",
  "issueTitleWeb": "🌐 Oficjalny Raport Treści AI",
  "issueTitleTrending": "📈 Trendy Open Source w AI",
  "issueTitleHn": "📰 Przegląd AI z Hacker News",
  "issueTitlePh": "🚀 Product Hunt AI Digest",
  "issueTitleArxiv": "📚 ArXiv AI Research Digest",
  "issueTitleHf": "🤗 Hugging Face Trending Models",
  "issueTitleCommunity": "💬 Tech Community AI Digest",
  "autoGen": "This digest is auto-generated by",
  "reportLabelAiCli": "AI CLI Tools Digest",
  "reportLabelAiAgents": "AI Agents Ecosystem Digest",
  "reportLabelAiWeb": "Official AI Content Report",
  "reportLabelAiTrending": "AI Open Source Trends",
  "reportLabelAiHn": "Hacker News AI Community Digest",
  "reportLabelAiPh": "Product Hunt AI Products Digest",
  "reportLabelAiArxiv": "ArXiv AI Research Digest",
  "reportLabelAiHf": "Hugging Face Trending Models Digest",
  "reportLabelAiCommunity": "Tech Community AI Digest",
  "reportLabelAiWeekly": "AI Tools Weekly Digest",
  "reportLabelAiMonthly": "AI Tools Monthly Digest",
  "notifyCli": "Narzędzia CLI AI",
  "notifyAgents": "Ekosystem Agentów AI",
  "notifyWeb": "Oficjalne Aktualizacje",
  "notifyTrending": "Trendy GitHub",
  "notifyHn": "Społeczność HN",
  "notifyPh": "Product Hunt",
  "notifyArxiv": "ArXiv Research",
  "notifyHf": "HF Models",
  "notifyCommunity": "Tech Community",
  "notifyWeekly": "Narzędzia AI Tygodniowo",
  "notifyMonthly": "Narzędzia AI Miesięcznie",
  "notifyFooter": "Powered by Big Model Radar",
  "formatItemAuthor": "Autor",
  "formatItemCreated": "Utworzono",
  "formatItemUpdated": "Zaktualizowano",
  "formatItemComments": "Komentarze",
  "formatItemUrl": "URL",
  "formatItemSummary": "Podsumowanie",
  "sampleNote": "(Razem: {total} elementów; pokazuje {sampled} najczęściej komentowanych)",
  "sampleNoteAll": "(Razem: {total} elementów)",
  "noneStr": "Brak",
  "unableToExtract": "(Nie można wyodrębnić treści tekstowej)",
  "issueTruncation": "\n\n---\n> ⚠️ Treść przekracza limit GitHub Issue. Pełny raport znajduje się w zatwierdzonym pliku Markdown.",
  "digestTruncation": "...[przycięto]",
  "weeklyTruncation": "...[przycięto]",
  "weeklyMeta": "> Zakres: {range} | Wygenerowano: {utcStr} UTC",
  "monthlyMeta": "> Źródła: {sources} | Wygenerowano: {utcStr} UTC",
  "sourceLabelWeekly": "{n} raportów tygodniowych",
  "sourceLabelDailySampled": "{n} raportów dziennych (próbkowanie co 4 dni)",
  "manifestCli": "Przegląd Narzędzi CLI AI",
  "manifestAgents": "Przegląd Ekosystemu Agentów AI",
  "manifestWeb": "Oficjalny Raport Treści AI",
  "manifestTrending": "Trendy Open Source w AI",
  "manifestHn": "Przegląd AI z Hacker News",
  "manifestWeekly": "Tygodniowy Przegląd Narzędzi AI",
  "manifestMonthly": "Miesięczny Przegląd Narzędzi AI",
  "autoGenFooter": ".",
  "hnMeta": "> Source: [Hacker News](https://news.ycombinator.com/) | {count} stories | Generated: {utcStr} UTC\n\n---\n\n",
  "phMeta": "> Source: [Product Hunt](https://www.producthunt.com/) | {count} products | Generated: {utcStr} UTC\n\n---\n\n",
  "arxivMeta": "> Source: [ArXiv](https://arxiv.org/) (cs.AI, cs.CL, cs.LG) | {count} papers | Generated: {utcStr} UTC\n\n---\n\n",
  "hfMeta": "> Source: [Hugging Face Hub](https://huggingface.co/) | {count} models | Generated: {utcStr} UTC\n\n---\n\n",
  "communityMeta": "> Sources: [Dev.to](https://dev.to/) ({devto} articles) + [Lobste.rs](https://lobste.rs/) ({lobsters} stories) | Generated: {utcStr} UTC\n\n---\n\n",
  "trendingMeta": "> {sources} | Generated: {utcStr} UTC\n\n---\n\n",
  "webSourcesAnthropic": "- Anthropic: [anthropic.com](https://www.anthropic.com) — {new} new articles (sitemap total: {total})",
  "webSourcesOpenai": "- OpenAI: [openai.com](https://openai.com) — {new} new articles (sitemap total: {total})",
  "webIssueTitle": "🌐 Official AI Content Report {dateStr}",
  "webIssueTitleFirstCrawl": "🌐 Official AI Content Report {dateStr} (First Crawl)",
  "notifySuffixMonthly": " Monthly",
  "notifySuffixWeekly": " Weekly",
  "notifyFooterLinks": "<a href=\"{pagesUrl}\">🌐 Web UI</a>  ·  <a href=\"{pagesUrl}/feed.xml\">⊕ RSS</a>",
  "feishuFooterLinks": "[🌐 Web UI]({pagesUrl})  ·  [⊕ RSS]({pagesUrl}/feed.xml)",
  "trendingFetchFailed": "(Unable to fetch today's GitHub Trending list)",
  "searchNoResults": "(No search results)"
}
