{
  "noActivity": "لا يوجد نشاط في آخر 24 ساعة.",
  "summaryFailed": "⚠️ فشل إنشاء الملخص.",
  "skillsFailed": "⚠️ فشل إنشاء ملخص المهارات.",
  "trendingNoData": "⚠️ بيانات الاتجاهات غير متوفرة، تعذر إنشاء التقرير.",
  "trendingFailed": "⚠️ فشل إنشاء تقرير الاتجاهات.",
  "trendingFetchFailed": "(تعذر جلب قائمة الاتجاهات اليومية على GitHub)",
  "searchNoResults": "(لا توجد نتائج بحث)",
  "webNoNewContent": "لم يتم العثور على محتوى جديد.",
  "webFetchFailed": "⚠️ فشل جلب محتوى الويب.",
  "hnFetchFailed": "⚠️ فشل جلب بيانات HN.",
  "cliTitle": "ملخص مجتمع أدوات CLI للذكاء الاصطناعي",
  "cliMeta": "> تم الإنشاء: {utcStr} UTC | الأدوات المشمولة: {count}",
  "cliSkillsHeading": "## أبرز مهارات Claude Code",
  "cliSkillsSource": "> المصدر: [{repo}](https://github.com/{repo})",
  "cliComparison": "## مقارنة بين الأدوات",
  "cliDetail": "## تقارير كل أداة",
  "openclawTitle": "ملخص نظام OpenClaw البيئي",
  "openclawMeta": "> المشكلات: {issues} | طلبات السحب: {prs} | المشاريع المشمولة: {projects} | تم الإنشاء: {utcStr} UTC",
  "openclawDeepDive": "## غوص عميق في OpenClaw",
  "openclawComparison": "## مقارنة بين الأنظمة البيئية",
  "openclawPeers": "## تقارير المشاريع النظيرة",
  "webTitle": "التقرير الرسمي لمحتوى الذكاء الاصطناعي",
  "webMeta": "> {mode} | محتوى جديد: {count} مقال | تم الإنشاء: {utcStr} UTC",
  "webFirstCrawl": "أول زحف كامل",
  "webTodayUpdate": "تحديث اليوم",
  "webNewContent": "محتوى جديد: {count} مقال",
  "webGenerated": "تاريخ الإنشاء: {utcStr} UTC",
  "webSourcesHeader": "المصادر:",
  "webFirstCrawlNote": "هذا هو الزحف الكامل الأول. يرجى التركيز على المشهد العام للمحتوى والسياق التاريخي والمواضيع الأساسية لكل موقع، بدلاً من المقالات الفردية.",
  "webIncrementalNote": "هذا تحديث تدريجي. يرجى التركيز على المحتوى الجديد اليوم وتقييم أهميته الاستراتيجية في السياق.",
  "trendingTitle": "اتجاهات المصادر المفتوحة للذكاء الاصطناعي",
  "trendingSources": "> المصادر: GitHub Trending + GitHub Search API | تم الإنشاء: {utcStr} UTC",
  "hnTitle": "ملخص مجتمع الذكاء الاصطناعي في Hacker News",
  "phTitle": "ملخص منتجات الذكاء الاصطناعي من Product Hunt",
  "arxivTitle": "ملخص أبحاث الذكاء الاصطناعي من ArXiv",
  "hfTitle": "ملخص النماذج الرائجة على Hugging Face",
  "communityTitle": "ملخص الذكاء الاصطناعي من مجتمع التقنية",
  "weeklyTitle": "التقرير الأسبوعي لنظام أدوات الذكاء الاصطناعي البيئي",
  "weeklyCoverage": "الفترة المشمولة",
  "monthlyTitle": "التقرير الشهري لنظام أدوات الذكاء الاصطناعي البيئي",
  "issueLabelCli": "digest",
  "issueLabelOpenclaw": "openclaw",
  "issueLabelWeb": "web",
  "issueLabelTrending": "trending",
  "issueLabelHn": "hn",
  "issueLabelPh": "ph",
  "issueLabelArxiv": "arxiv",
  "issueLabelHf": "hf",
  "issueLabelCommunity": "community",
  "issueTitleCli": "📊 ملخص مجتمع أدوات CLI للذكاء الاصطناعي",
  "issueTitleOpenclaw": "🦞 ملخص نظام OpenClaw البيئي",
  "issueTitleWeb": "🌐 التقرير الرسمي لمحتوى الذكاء الاصطناعي",
  "issueTitleTrending": "📈 اتجاهات المصادر المفتوحة للذكاء الاصطناعي",
  "issueTitleHn": "📰 ملخص الذكاء الاصطناعي من Hacker News",
  "issueTitlePh": "🚀 ملخص الذكاء الاصطناعي من Product Hunt",
  "issueTitleArxiv": "📚 ملخص أبحاث الذكاء الاصطناعي من ArXiv",
  "issueTitleHf": "🤗 النماذج الرائجة على Hugging Face",
  "issueTitleCommunity": "💬 ملخص الذكاء الاصطناعي من مجتمع التقنية",
  "autoGen": "يتم إنشاء هذا الملخص تلقائيًا بواسطة",
  "reportLabelAiCli": "ملخص أدوات سطر الأوامر للذكاء الاصطناعي",
  "reportLabelAiAgents": "ملخص منظومة وكلاء الذكاء الاصطناعي",
  "reportLabelAiWeb": "التقرير الرسمي لمحتوى الذكاء الاصطناعي",
  "reportLabelAiTrending": "اتجاهات الذكاء الاصطناعي مفتوح المصدر",
  "reportLabelAiHn": "ملخص مجتمع الذكاء الاصطناعي على Hacker News",
  "reportLabelAiPh": "ملخص منتجات الذكاء الاصطناعي من Product Hunt",
  "reportLabelAiArxiv": "ملخص أبحاث الذكاء الاصطناعي من ArXiv",
  "reportLabelAiHf": "ملخص النماذج الرائجة على Hugging Face",
  "reportLabelAiCommunity": "ملخص الذكاء الاصطناعي من مجتمع التقنية",
  "reportLabelAiWeekly": "ملخص أسبوعي لأدوات الذكاء الاصطناعي",
  "reportLabelAiMonthly": "ملخص شهري لأدوات الذكاء الاصطناعي",
  "notifyCli": "أدوات CLI للذكاء الاصطناعي",
  "notifyAgents": "نظام وكلاء الذكاء الاصطناعي البيئي",
  "notifyWeb": "التحديثات الرسمية",
  "notifyTrending": "اتجاهات GitHub",
  "notifyHn": "مجتمع HN",
  "notifyPh": "Product Hunt",
  "notifyArxiv": "أبحاث ArXiv",
  "notifyHf": "نماذج HF",
  "notifyCommunity": "مجتمع التقنية",
  "notifyWeekly": "أدوات الذكاء الاصطناعي أسبوعياً",
  "notifyMonthly": "أدوات الذكاء الاصطناعي شهرياً",
  "notifyFooter": "مدعوم من Big Model Radar",
  "formatItemAuthor": "المؤلف",
  "formatItemCreated": "تاريخ الإنشاء",
  "formatItemUpdated": "تاريخ التحديث",
  "formatItemComments": "التعليقات",
  "formatItemUrl": "الرابط",
  "formatItemSummary": "الملخص",
  "sampleNote": "(الإجمالي: {total} عنصر؛ عرض أفضل {sampled} حسب عدد التعليقات)",
  "sampleNoteAll": "(الإجمالي: {total} عنصر)",
  "noneStr": "لا يوجد",
  "unableToExtract": "(تعذر استخراج المحتوى النصي)",
  "issueTruncation": "\n\n---\n> ⚠️ المحتوى يتجاوز حد GitHub Issue. يُرجى مراجعة ملف Markdown المُرسَل للحصول على التقرير الكامل.",
  "digestTruncation": "...[مبتور]",
  "weeklyTruncation": "...[مبتور]",
  "weeklyMeta": "> التغطية: {range} | تم الإنشاء: {utcStr} UTC",
  "monthlyMeta": "> المصادر: {sources} | تم الإنشاء: {utcStr} UTC",
  "sourceLabelWeekly": "{n} تقارير أسبوعية",
  "sourceLabelDailySampled": "{n} تقارير يومية (معاينة كل 4 أيام)",
  "manifestCli": "ملخص أدوات CLI للذكاء الاصطناعي",
  "manifestAgents": "ملخص نظام وكلاء الذكاء الاصطناعي البيئي",
  "manifestWeb": "التقرير الرسمي لمحتوى الذكاء الاصطناعي",
  "manifestTrending": "اتجاهات المصادر المفتوحة للذكاء الاصطناعي",
  "manifestHn": "ملخص مجتمع الذكاء الاصطناعي في Hacker News",
  "manifestWeekly": "الملخص الأسبوعي لأدوات الذكاء الاصطناعي",
  "manifestMonthly": "الملخص الشهري لأدوات الذكاء الاصطناعي",
  "autoGenFooter": ".",
  "hnMeta": "> المصدر: [Hacker News](https://news.ycombinator.com/) | {count} قصة | تاريخ الإنشاء: {utcStr} UTC\n\n---\n\n",
  "phMeta": "> المصدر: [Product Hunt](https://www.producthunt.com/) | {count} منتج | تاريخ الإنشاء: {utcStr} UTC\n\n---\n\n",
  "arxivMeta": "> المصدر: [ArXiv](https://arxiv.org/) (cs.AI, cs.CL, cs.LG) | {count} ورقة بحثية | تاريخ الإنشاء: {utcStr} UTC\n\n---\n\n",
  "hfMeta": "> المصدر: [Hugging Face Hub](https://huggingface.co/) | {count} نموذج | تاريخ الإنشاء: {utcStr} UTC\n\n---\n\n",
  "communityMeta": "> المصادر: [Dev.to](https://dev.to/) ({devto} مقال) + [Lobste.rs](https://lobste.rs/) ({lobsters} قصة) | تاريخ الإنشاء: {utcStr} UTC\n\n---\n\n",
  "trendingMeta": "> {sources} | تاريخ الإنشاء: {utcStr} UTC\n\n---\n\n",
  "webSourcesAnthropic": "- Anthropic: [anthropic.com](https://www.anthropic.com) — {new} مقال جديد (إجمالي خريطة الموقع: {total})",
  "webSourcesOpenai": "- OpenAI: [openai.com](https://openai.com) — {new} مقال جديد (إجمالي خريطة الموقع: {total})",
  "webIssueTitle": "🌐 التقرير الرسمي لمحتوى الذكاء الاصطناعي {dateStr}",
  "webIssueTitleFirstCrawl": "🌐 التقرير الرسمي لمحتوى الذكاء الاصطناعي {dateStr} (أول زحف كامل)",
  "notifySuffixMonthly": " شهري",
  "notifySuffixWeekly": " أسبوعي",
  "notifyFooterLinks": "<a href=\"{pagesUrl}\">🌐 Web UI</a>  ·  <a href=\"{pagesUrl}/feed.xml\">⊕ RSS</a>",
  "feishuFooterLinks": "[🌐 Web UI]({pagesUrl})  ·  [⊕ RSS]({pagesUrl}/feed.xml)",
  "_meta": {
    "name": "Arabic",
    "nativeName": "العربية",
    "code": "ar-SA"
  },
  "$schema": "../locale-schema.json"
}
